{
  "$schema": "./schema.json",
  "code": "ar",
  "label": "ع",
  "name": "العربية",
  "dir": "rtl",
  "numberingSystem": "latn",
  "fonts": {
    "ui": "\"IBM Plex Sans Arabic\", \"Noto Sans Arabic\", Tahoma, sans-serif",
    "hero": "\"IBM Plex Sans Arabic\", \"Plus Jakarta Sans\", Tahoma, sans-serif",
    "platforms": {
      "chrome": {
        "ui": "\"Noto Sans Arabic\", Tahoma, sans-serif",
        "hero": "\"Noto Sans Arabic\", Tahoma, sans-serif"
      },
      "linux": {
        "ui": "\"Noto Sans Arabic\", Tahoma, sans-serif",
        "hero": "\"Noto Sans Arabic\", Tahoma, sans-serif"
      },
      "xp": {
        "ui": "Tahoma, sans-serif",
        "hero": "Tahoma, sans-serif"
      },
      "w98": {
        "ui": "Tahoma, sans-serif",
        "hero": "Tahoma, sans-serif"
      }
    }
  },
  "pluralRules": {
    "zero": "n = 0",
    "one": "n = 1",
    "two": "n = 2",
    "few": "n % 100 = 3..10",
    "many": "n % 100 = 11..99"
  },
  "plurals": {
    "process": {
      "zero": "{n} عملية",
      "one": "عملية واحدة",
      "two": "عمليتان",
      "few": "{n} عمليات",
      "many": "{n} عملية",
      "other": "{n} عملية"
    },
    "thread": {
      "zero": "{n} خيط",
      "one": "خيط واحد",
      "two": "خيطان",
      "few": "{n} خيوط",
      "many": "{n} خيطاً",
      "other": "{n} خيط"
    },
    "core": {
      "zero": "{n} نواة",
      "one": "نواة واحدة",
      "two": "نواتان",
      "few": "{n} أنوية",
      "many": "{n} نواة",
      "other": "{n} نواة"
    },
    "cycle": {
      "zero": "{n} دورة",
      "one": "دورة واحدة",
      "two": "دورتان",
      "few": "{n} دورات",
      "many": "{n} دورة",
      "other": "{n} دورة"
    },
    "ended": {
      "zero": "لم يتم إنهاء أي تطبيق بعد",
      "one": "تطبيق واحد منتهٍ في هذه الجلسة",
      "two": "تطبيقان منتهيان في هذه الجلسة",
      "few": "{n} تطبيقات منتهية في هذه الجلسة",
      "many": "{n} تطبيقاً منتهياً في هذه الجلسة",
      "other": "{n} تطبيق منتهٍ في هذه الجلسة"
    }
  },
  "strings": {
    "calm": "النظام هادئ",
    "hogPill": "تنبيه استهلاك",
    "pillValue": "{label} · {value}",
    "cpu": "المعالج",
    "mem": "الذاكرة",
    "nrg": "الطاقة",
    "thm": "الحرارة",
    "gpu": "الرسوميات",
    "storage": "التخزين",
    "network": "الشبكة",
    "barCpu": "CPU",
    "barRam": "RAM",
    "util": "الاستخدام",
    "high": "مرتفع",
    "userSys": "مستخدم {user} · نظام {sys}",
    "cpuDetailSub": "مستخدم {user} · نظام {sys} · {cores}",
    "segApp": "تطبيقات",
    "segFree": "متاحة",
    "memOf": "{used} من {total}",
    "memInUse": "{used} من {total} قيد الاستخدام",
    "pressure": "ضغط طبيعي",
    "pressureShort": "طبيعي",
    "pressureHigh": "ضغط مرتفع",
    "pressureHighShort": "مرتفع",
    "pressureCritical": "ضغط حرج",
    "pressureCriticalShort": "حرج",
    "health": "الصحة {pct} · {cycles}",
    "onBatt": "على البطارية",
    "charging": "يشحن",
    "timeLeft": "متبقٍ {time}",
    "fullIn": "يكتمل خلال {time}",
    "onBattLeft": "على البطارية · متبقٍ {time}",
    "chargingFullIn": "يشحن · يكتمل خلال {time}",
    "durHM": "{h}س {m}د",
    "durM": "{m}د",
    "cool": "بارد",
    "warm": "دافئ",
    "hot": "ساخن",
    "throttled": "مقيَّد",
    "zero": "لا يوجد تقييد حراري",
    "throttling": "يتم تقييد المعالج",
    "tempLine": "المعالج {cpu} · الرسوميات {gpu}",
    "used": "مستخدم {pct}",
    "free": "{value} متاحة",
    "min1": "دقيقة",
    "top": "أكثر التطبيقات استهلاكاً",
    "end": "إنهاء",
    "endApp": "إنهاء التطبيق",
    "endNamed": "إنهاء {app}",
    "hogTitle": "{app} يستهلك {pct} من المعالج",
    "hogSub": "فوق {pct} من المعالج لأكثر من دقيقتين",
    "privacy": "محلي فقط · بلا اتصال",
    "quit": "خروج",
    "confirmTitle": "إنهاء {app}؟",
    "confirmSub": "قد تفقد العمل غير المحفوظ في هذا التطبيق.",
    "confirmBtn": "إنهاء",
    "cancel": "إلغاء",
    "toastEnded": "تم إنهاء {app} · المعالج يعود إلى وضعه الطبيعي",
    "toastMonitor": "جارٍ فتح {monitor}…",
    "toastRestored": "تمت استعادة التطبيقات",
    "openMonitor": "فتح {monitor}",
    "tipCore": "حصة الأنوية",
    "tipUserKernel": "المستخدم / النواة",
    "tipRam": "الذاكرة",
    "tipGpu": "الرسوميات",
    "tipProc": "العمليات",
    "tipClick": "انقر لعرض آخر 10 دقائق ←",
    "back": "رجوع",
    "ago10": "قبل 10 د",
    "ago5": "5 د",
    "now": "الآن",
    "agoMS": "قبل {m}د {s}ث",
    "agoS": "قبل {s}ث",
    "agoM": "قبل {m}د",
    "last10": "آخر 10 دقائق",
    "peakAvg": "الذروة {peak} · المتوسط {avg}",
    "peakSplit": "الذروة {a} · {b}",
    "read": "قراءة",
    "write": "كتابة",
    "down": "تنزيل",
    "up": "رفع",
    "unitCpu": "معالج",
    "unitRam": "ذاكرة",
    "unitGpu": "رسوميات",
    "unitOfCpu": "من المعالج",
    "tUser": "المستخدم",
    "tSystem": "النظام",
    "tIdle": "خامل",
    "tLoad": "متوسط الحمل",
    "tZramStored": "ZRAM المخزّنة",
    "tZramRatio": "نسبة الضغط",
    "zramSub": "ZRAM يضغط {orig} إلى {comp} · الأجهزة الافتراضية {pct}",
    "tDraw": "الاستهلاك",
    "tTimeLeft": "الوقت المتبقي",
    "tHealth": "الصحة",
    "tCycles": "الدورات",
    "tCapacity": "السعة",
    "tSource": "مصدر الطاقة",
    "tBattery": "البطارية",
    "tCpuDie": "نواة المعالج",
    "tStorage": "التخزين",
    "tFans": "المراوح",
    "tThrottling": "التقييد",
    "tTemperature": "درجة الحرارة",
    "tVideoMem": "ذاكرة الفيديو",
    "tCoreClock": "تردد النواة",
    "tPower": "الطاقة",
    "tHotspot": "أعلى نقطة",
    "tUsed": "المستخدم",
    "tFree": "المتاح",
    "tVerified": "سليم",
    "tFormat": "التنسيق",
    "tInterface": "الواجهة",
    "tLatency": "زمن الاستجابة",
    "tToday": "اليوم",
    "tThreads": "الخيوط",
    "aSettings": "الإعدادات",
    "simHog": "محاكاة تطبيق مستنزف",
    "simHogSub": "تطبيق واحد يستهلك أكثر من {pct} من المعالج",
    "simCharging": "الشحن",
    "simChargingSub": "محوّل {adapter} متصل",
    "simLive": "تحديث مباشر",
    "simLiveSub": "تحديث القراءات كل {secs}",
    "seconds": "{n} ث",
    "tempUnit": "وحدة الحرارة",
    "restore": "استعادة التطبيقات المنتهية",
    "restoreBtn": "استعادة",
    "simNote": "تشغّل هذه المفاتيح بيانات تجريبية.",
    "closedRunning": "لا يزال Pulse يعمل في {bar}. انقر على أيقونته لإعادة الفتح.",
    "closedQuit": "تم إغلاق Pulse.",
    "openPulse": "فتح Pulse",
    "checkUpdates": "التحقق من وجود تحديثات…",
    "updateAvailable": "يتوفر Pulse {version}. لديك {current}. هل تريد تنزيله وتثبيته الآن؟",
    "updateNone": "لديك أحدث إصدار من Pulse ({current}).",
    "updateFailed": "تعذّر تحديث Pulse: {error}",
    "updateInstall": "تحديث",
    "updateLater": "ليس الآن",
    "updating": "جارٍ تنزيل Pulse {version}…",
    "updateMove": "انقل Pulse إلى مجلد التطبيقات، ثم أعد المحاولة.",
    "relaunch": "إعادة تشغيل Pulse",
    "aClose": "إغلاق",
    "aLang": "تبديل اللغة",
    "language": "اللغة",
    "languageSub": "اختر لغة التطبيق",
    "langSystem": "حسب النظام",
    "aDismiss": "إخفاء التنبيه",
    "aDark": "الوضع الداكن",
    "aLight": "الوضع الفاتح",
    "menuFile": "ملف",
    "menuEdit": "تحرير",
    "menuView": "عرض",
    "menuGo": "انتقال",
    "macClock": "الأحد 4 أكتوبر  9:41",
    "winTime": "9:41 ص",
    "winDate": "4/10/2026",
    "chromeTime": "9:41",
    "startXp": "ابدأ",
    "start98": "ابدأ",
    "winTitle": "Pulse — صحة الجهاز",
    "listSep": " · ",
    "endFailed": "تعذّر إنهاء {app}",
    "acPower": "على التيار الكهربائي",
    "noBattery": "لا توجد بطارية",
    "srcTitle": "مصادر البيانات",
    "srcLive": "مباشر",
    "srcSim": "محاكاة",
    "srcNone": "غير متاح",
    "srcLine9x": "البيانات: {list}",
    "srcLineNt": "مضيف NT: لا يوجد {missing}. يُستخدم {api}.",
    "notOnNt": "غير مستخدم في NT",
    "perAppNa": "استهلاك المعالج لكل تطبيق غير متاح في Windows 9x",
    "arabicNa": "العربية تحتاج صفحة الترميز 1256 وخطاً عربياً"
  },
  "hardware": {
    "coreP": "أنوية الأداء",
    "coreE": "أنوية الكفاءة",
    "coreZen4": "أنوية Zen 4",
    "coreZen4c": "أنوية Zen 4c",
    "coreN": "النواة {n}",
    "user": "المستخدم",
    "kernel": "النواة",
    "wired": "المقيّدة",
    "compressed": "مضغوطة",
    "system": "النظام",
    "buffers": "المخازن",
    "cache": "المؤقتة",
    "diskCache": "ذاكرة القرص",
    "swapUsed": "التبديل المستخدم",
    "committed": "الذاكرة الملتزمة",
    "pressure": "الضغط",
    "psiPressure": "ضغط PSI",
    "pageFile": "ملف الصفحات",
    "commitCharge": "الحمل الملتزم",
    "swapFile": "ملف التبديل",
    "sysResources": "موارد النظام",
    "normal": "طبيعي",
    "pctNormal": "{pct} · طبيعي",
    "pctFree": "{pct} متاحة",
    "localDisk": "القرص المحلي ({drive})",
    "internalStorage": "التخزين الداخلي",
    "fsRoot": "نظام الملفات الجذر ({path})",
    "drive": "محرك الأقراص {drive}",
    "lanConnection": "اتصال الشبكة المحلية",
    "dialUp": "شبكة الطلب الهاتفي",
    "netSub": "{link} · {detail} · {state}",
    "strongSignal": "إشارة قوية",
    "connected": "متصل",
    "modem": "مودم {speed}",
    "signal": "الإشارة",
    "linkSpeed": "سرعة الارتباط",
    "lineSpeed": "سرعة الخط",
    "vramUnified": "موحّدة · {size}",
    "vramShared": "{size} مشتركة",
    "fansOff": "متوقفة · {rpm}",
    "fanless": "بلا مراوح",
    "activityMonitor": "مراقب النشاط",
    "taskManager": "مدير المهام",
    "diagnostics": "التشخيص",
    "systemMonitor": "مراقب النظام",
    "menuBar": "شريط القوائم",
    "taskbar": "شريط المهام",
    "shelf": "الرف",
    "topBar": "الشريط العلوي",
    "notificationArea": "منطقة الإعلام"
  },
  "apps": {
    "WindowServer": "خادم النوافذ",
    "Antimalware Service": "خدمة مكافحة البرمجيات الضارة",
    "Desktop Window Manager": "مدير نوافذ سطح المكتب",
    "System UI": "واجهة النظام",
    "Files": "الملفات",
    "Explorer": "مستكشف Windows",
    "explorer.exe": "مستكشف Windows",
    "Paint": "الرسام"
  }
}
