{
  "code": "en-XA",
  "label": "XA",
  "name": "Pseudo (long)",
  "dir": "ltr",
  "numberingSystem": "latn",
  "fallback": "en",
  "pluralRules": {
    "one": "i = 1 and v = 0"
  },
  "plurals": {
    "process": {
      "one": "[1 próçéšš ẋ]",
      "other": "[{n} próçéššéš ẋ]"
    },
    "thread": {
      "one": "[1 thréád ẋ]",
      "other": "[{n} thréádš ẋ]"
    },
    "core": {
      "one": "[1 çóré ẋ]",
      "other": "[{n} çóréš ẋ]"
    },
    "cycle": {
      "one": "[1 çýçlé ẋ]",
      "other": "[{n} çýçléš ẋ]"
    },
    "ended": {
      "=0": "[Nó áppš éñdéd ýét ẋẋẋẋ]",
      "one": "[1 ápp éñdéd thíš šéššíóñ ẋẋẋẋẋẋẋ]",
      "other": "[{n} áppš éñdéd thíš šéššíóñ ẋẋẋẋẋẋẋ]"
    }
  },
  "strings": {
    "calm": "[Sýštém Cálm ẋẋ]",
    "hogPill": "[Hóg Álért ẋ]",
    "pillValue": "[{label} · {value} ẋ]",
    "cpu": "[CPÚ ẋ]",
    "mem": "[Mémórý ẋ]",
    "nrg": "[Éñérgý ẋ]",
    "thm": "[Thérmál ẋ]",
    "gpu": "[GPÚ ẋ]",
    "storage": "[Stórágé ẋ]",
    "network": "[Nétwórk ẋ]",
    "barCpu": "[CPÚ ẋ]",
    "barRam": "[RÁM ẋ]",
    "util": "[Útílízátíóñ ẋẋ]",
    "high": "[Hígh ẋ]",
    "userSys": "[Úšér {user} · Sýš {sys} ẋẋ]",
    "cpuDetailSub": "[Úšér {user} · Sýštém {sys} · {cores} ẋẋẋẋẋ]",
    "segApp": "[Ápp ẋ]",
    "segFree": "[Fréé ẋ]",
    "memOf": "[{used} óf {total} ẋ]",
    "memInUse": "[{used} óf {total} íñ úšé ẋẋ]",
    "pressure": "[Nórmál préššúré ẋẋẋ]",
    "pressureShort": "[Nórmál ẋ]",
    "pressureHigh": "[Hígh préššúré ẋẋẋ]",
    "pressureHighShort": "[Hígh ẋ]",
    "pressureCritical": "[Crítíçál préššúré ẋẋẋẋ]",
    "pressureCriticalShort": "[Crítíçál ẋ]",
    "health": "[Héálth {pct} · {cycles} ẋ]",
    "onBatt": "[óñ báttérý ẋ]",
    "charging": "[çhárgíñg ẋ]",
    "timeLeft": "[{time} léft ẋ]",
    "fullIn": "[Fúll íñ {time} ẋ]",
    "onBattLeft": "[Óñ báttérý · {time} léft ẋẋẋẋẋ]",
    "chargingFullIn": "[Chárgíñg · Fúll íñ {time} ẋẋẋẋẋ]",
    "durHM": "[{h}h {m}m ẋ]",
    "durM": "[{m}m ẋ]",
    "cool": "[Cóól ẋ]",
    "warm": "[Wárm ẋ]",
    "hot": "[Hót ẋ]",
    "throttled": "[Thróttléd ẋ]",
    "zero": "[Zéró thérmál thróttlíñg ẋẋẋẋẋẋẋ]",
    "throttling": "[CPÚ íš béíñg thróttléd ẋẋẋẋẋẋ]",
    "tempLine": "[CPÚ {cpu} · GPÚ {gpu} ẋẋ]",
    "used": "[{pct} úšéd ẋ]",
    "free": "[{value} fréé ẋ]",
    "min1": "[1 míñ ẋ]",
    "top": "[Tóp Áçtívé Áppš ẋẋẋ]",
    "end": "[Éñd ẋ]",
    "endApp": "[Éñd Ápp ẋ]",
    "endNamed": "[Éñd {app} ẋ]",
    "hogTitle": "[{app} íš úšíñg {pct} óf tótál CPÚ ẋẋẋẋẋẋẋ]",
    "hogSub": "[Ábóvé {pct} óf tótál CPÚ fór óvér 2 míñ ẋẋẋẋẋẋẋẋẋẋẋ]",
    "privacy": "[Lóçál-óñlý · 0 ñétwórk ẋẋẋẋẋẋ]",
    "quit": "[Qúít ẋ]",
    "confirmTitle": "[Qúít {app}? ẋ]",
    "confirmSub": "[Úñšávéd wórk íñ thíš ápp máý bé lóšt. ẋẋẋẋẋẋẋẋẋẋẋẋ]",
    "confirmBtn": "[Qúít ápp ẋ]",
    "cancel": "[Cáñçél ẋ]",
    "toastEnded": "[{app} éñdéd · CPÚ šéttlíñg báçk tó ñórmál ẋẋẋẋẋẋẋẋẋẋẋẋ]",
    "toastMonitor": "[Ópéñíñg {monitor}… ẋ]",
    "toastRestored": "[Éñdéd áppš réštóréd ẋẋẋẋẋ]",
    "openMonitor": "[Ópéñ {monitor} ẋ]",
    "tipCore": "[Córé šháré ẋ]",
    "tipUserKernel": "[Úšér / Kérñél ẋẋẋ]",
    "tipRam": "[RÁM ẋ]",
    "tipGpu": "[GPÚ ẋ]",
    "tipProc": "[Próçéššéš ẋ]",
    "tipClick": "[Clíçk fór 10-míñ tímélíñé → ẋẋẋẋẋẋẋẋ]",
    "back": "[Báçk ẋ]",
    "ago10": "[10m ágó ẋ]",
    "ago5": "[5m ẋ]",
    "now": "[Nów ẋ]",
    "agoMS": "[{m}m {s}š ágó ẋ]",
    "agoS": "[{s}š ágó ẋ]",
    "agoM": "[{m}m ágó ẋ]",
    "last10": "[Lášt 10 míñútéš ẋẋẋ]",
    "peakAvg": "[Péák {peak} · Ávg {avg} ẋẋ]",
    "peakSplit": "[Péák {a} · {b} ẋ]",
    "read": "[Réád ẋ]",
    "write": "[Wríté ẋ]",
    "down": "[Dówñ ẋ]",
    "up": "[Úp ẋ]",
    "unitCpu": "[CPÚ ẋ]",
    "unitRam": "[RÁM ẋ]",
    "unitGpu": "[GPÚ ẋ]",
    "unitOfCpu": "[óf CPÚ ẋ]",
    "tUser": "[Úšér ẋ]",
    "tSystem": "[Sýštém ẋ]",
    "tIdle": "[Ídlé ẋ]",
    "tLoad": "[Lóád ávérágé ẋẋ]",
    "tZramStored": "[ZRÁM štóréd ẋẋ]",
    "tZramRatio": "[ZRÁM rátíó ẋ]",
    "zramSub": "[ZRÁM çómpréššíñg {orig} íñtó {comp} · VMš šháré {pct} ẋẋẋẋẋẋẋẋẋẋẋẋ]",
    "tDraw": "[Dráw ẋ]",
    "tTimeLeft": "[Tímé léft ẋ]",
    "tHealth": "[Héálth ẋ]",
    "tCycles": "[Cýçléš ẋ]",
    "tCapacity": "[Cápáçítý ẋ]",
    "tSource": "[Sóúrçé ẋ]",
    "tBattery": "[Báttérý ẋ]",
    "tCpuDie": "[CPÚ díé ẋ]",
    "tStorage": "[Stórágé ẋ]",
    "tFans": "[Fáñš ẋ]",
    "tThrottling": "[Thróttlíñg ẋ]",
    "tTemperature": "[Témpérátúré ẋẋ]",
    "tVideoMem": "[Vídéó mémórý ẋẋ]",
    "tCoreClock": "[Córé çlóçk ẋ]",
    "tPower": "[Pówér ẋ]",
    "tHotspot": "[Hótšpót ẋ]",
    "tUsed": "[Úšéd ẋ]",
    "tFree": "[Fréé ẋ]",
    "tVerified": "[Vérífíéd ẋ]",
    "tFormat": "[Fórmát ẋ]",
    "tInterface": "[Íñtérfáçé ẋ]",
    "tLatency": "[Látéñçý ẋ]",
    "tToday": "[Tódáý ẋ]",
    "tThreads": "[Thréádš ẋ]",
    "aSettings": "[Séttíñgš ẋ]",
    "simHog": "[Símúláté CPÚ hóg ẋẋẋẋ]",
    "simHogSub": "[Óñé ápp hóldš móré tháñ {pct} óf tótál CPÚ ẋẋẋẋẋẋẋẋẋẋẋẋ]",
    "simCharging": "[Chárgíñg ẋ]",
    "simChargingSub": "[{adapter} ádáptér çóññéçtéd ẋẋẋẋẋ]",
    "simLive": "[Lívé úpdátéš ẋẋ]",
    "simLiveSub": "[Réfréšh réádíñgš évérý {secs} ẋẋẋẋẋẋẋ]",
    "seconds": "[{n} š ẋ]",
    "tempUnit": "[Témpérátúré úñít ẋẋẋẋ]",
    "restore": "[Réštóré éñdéd áppš ẋẋẋẋẋ]",
    "restoreBtn": "[Réštóré ẋ]",
    "simNote": "[Théšé šwítçhéš túrñ óñ démó dátá. ẋẋẋẋẋẋẋẋẋẋẋ]",
    "closedRunning": "[Púlšé íš štíll rúññíñg íñ thé {bar}. Clíçk ítš íçóñ tó réópéñ. ẋẋẋẋẋẋẋẋẋẋẋẋẋẋẋẋẋẋẋẋ]",
    "closedQuit": "[Púlšé háš qúít. ẋẋẋ]",
    "openPulse": "[Ópéñ Púlšé ẋ]",
    "relaunch": "[Réláúñçh Púlšé ẋẋẋ]",
    "aClose": "[Clóšé ẋ]",
    "aLang": "[Swítçh láñgúágé ẋẋẋ]",
    "language": "[Láñgúágé ẋ]",
    "languageSub": "[Píçk thé ápp'š láñgúágé ẋẋẋẋẋẋẋ]",
    "langSystem": "[Mátçh šýštém ẋẋ]",
    "aDismiss": "[Díšmíšš álért ẋẋẋ]",
    "aDark": "[Dárk módé ẋ]",
    "aLight": "[Líght módé ẋ]",
    "menuFile": "[Fílé ẋ]",
    "menuEdit": "[Édít ẋ]",
    "menuView": "[Víéw ẋ]",
    "menuGo": "[Gó ẋ]",
    "macClock": "[Súñ 4 Óçt  9:41 ẋẋẋ]",
    "winTime": "[9:41 ÁM ẋ]",
    "winDate": "[10/4/2026 ẋ]",
    "chromeTime": "[9:41 ẋ]",
    "startXp": "[štárt ẋ]",
    "start98": "[Stárt ẋ]",
    "winTitle": "[Púlšé — Sýštém vítálš ẋẋẋẋẋẋ]",
    "listSep": " · ",
    "endFailed": "[Cóúldñ't éñd {app} ẋẋẋ]",
    "acPower": "[Óñ ÁC pówér ẋẋ]",
    "noBattery": "[Nó báttérý ẋ]"
  },
  "hardware": {
    "coreP": "[P-Córéš ẋ]",
    "coreE": "[É-Córéš ẋ]",
    "coreZen4": "[Zéñ 4 çóréš ẋẋ]",
    "coreZen4c": "[Zéñ 4ç çóréš ẋẋ]",
    "coreN": "[Córé {n} ẋ]",
    "user": "[Úšér ẋ]",
    "kernel": "[Kérñél ẋ]",
    "wired": "[Wíréd ẋ]",
    "compressed": "[Cómpréššéd ẋ]",
    "system": "[Sýštém ẋ]",
    "buffers": "[Búfférš ẋ]",
    "cache": "[Cáçhé ẋ]",
    "diskCache": "[Díšk çáçhé ẋ]",
    "swapUsed": "[Swáp úšéd ẋ]",
    "committed": "[Cómmíttéd ẋ]",
    "pressure": "[Préššúré ẋ]",
    "psiPressure": "[PSÍ préššúré ẋẋ]",
    "pageFile": "[Págé fílé ẋ]",
    "commitCharge": "[Cómmít çhárgé ẋẋẋ]",
    "swapFile": "[Swáp fílé ẋ]",
    "sysResources": "[Sýštém réšóúrçéš ẋẋẋẋ]",
    "normal": "[Nórmál ẋ]",
    "pctNormal": "[{pct} · Nórmál ẋ]",
    "pctFree": "[{pct} fréé ẋ]",
    "localDisk": "[Lóçál Díšk ({drive}) ẋẋẋ]",
    "internalStorage": "[Íñtérñál štórágé ẋẋẋẋ]",
    "fsRoot": "[Fíléšýštém róót ({path}) ẋẋẋẋẋ]",
    "drive": "[Drívé {drive} ẋ]",
    "lanConnection": "[Lóçál Áréá Cóññéçtíóñ ẋẋẋẋẋẋ]",
    "dialUp": "[Díál-Úp Nétwórkíñg ẋẋẋẋẋ]",
    "netSub": "[{link} · {detail} · {state} ẋ]",
    "strongSignal": "[Stróñg šígñál ẋẋẋ]",
    "connected": "[Cóññéçtéd ẋ]",
    "modem": "[{speed} módém ẋ]",
    "signal": "[Sígñál ẋ]",
    "linkSpeed": "[Líñk špééd ẋ]",
    "lineSpeed": "[Líñé špééd ẋ]",
    "vramUnified": "[Úñífíéd · {size} ẋ]",
    "vramShared": "[{size} šháréd ẋ]",
    "fansOff": "[Óff · {rpm} ẋ]",
    "fanless": "[Fáñléšš ẋ]",
    "activityMonitor": "[Áçtívítý Móñítór ẋẋẋẋ]",
    "taskManager": "[Tášk Máñágér ẋẋ]",
    "diagnostics": "[Díágñóštíçš ẋẋ]",
    "systemMonitor": "[Sýštém Móñítór ẋẋẋ]",
    "menuBar": "[méñú bár ẋ]",
    "taskbar": "[táškbár ẋ]",
    "shelf": "[šhélf ẋ]",
    "topBar": "[tóp bár ẋ]",
    "notificationArea": "[ñótífíçátíóñ áréá ẋẋẋẋ]"
  },
  "apps": {}
}
