{
  "$schema": "./schema.json",
  "code": "en",
  "label": "EN",
  "name": "English",
  "dir": "ltr",
  "numberingSystem": "latn",
  "pluralRules": {
    "one": "i = 1 and v = 0"
  },
  "plurals": {
    "process": {
      "one": "1 process",
      "other": "{n} processes"
    },
    "thread": {
      "one": "1 thread",
      "other": "{n} threads"
    },
    "core": {
      "one": "1 core",
      "other": "{n} cores"
    },
    "cycle": {
      "one": "1 cycle",
      "other": "{n} cycles"
    },
    "ended": {
      "=0": "No apps ended yet",
      "one": "1 app ended this session",
      "other": "{n} apps ended this session"
    }
  },
  "strings": {
    "calm": "System Calm",
    "hogPill": "Hog Alert",
    "pillValue": "{label} · {value}",
    "cpu": "CPU",
    "mem": "Memory",
    "nrg": "Energy",
    "thm": "Thermal",
    "gpu": "GPU",
    "storage": "Storage",
    "network": "Network",
    "barCpu": "CPU",
    "barRam": "RAM",
    "util": "Utilization",
    "high": "High",
    "userSys": "User {user} · Sys {sys}",
    "cpuDetailSub": "User {user} · System {sys} · {cores}",
    "segApp": "App",
    "segFree": "Free",
    "memOf": "{used} of {total}",
    "memInUse": "{used} of {total} in use",
    "pressure": "Normal pressure",
    "pressureShort": "Normal",
    "pressureHigh": "High pressure",
    "pressureHighShort": "High",
    "pressureCritical": "Critical pressure",
    "pressureCriticalShort": "Critical",
    "health": "Health {pct} · {cycles}",
    "onBatt": "on battery",
    "charging": "charging",
    "timeLeft": "{time} left",
    "fullIn": "Full in {time}",
    "onBattLeft": "On battery · {time} left",
    "chargingFullIn": "Charging · Full in {time}",
    "durHM": "{h}h {m}m",
    "durM": "{m}m",
    "cool": "Cool",
    "warm": "Warm",
    "hot": "Hot",
    "throttled": "Throttled",
    "zero": "Zero thermal throttling",
    "throttling": "CPU is being throttled",
    "tempLine": "CPU {cpu} · GPU {gpu}",
    "used": "{pct} used",
    "free": "{value} free",
    "min1": "1 min",
    "top": "Top Active Apps",
    "end": "End",
    "endApp": "End App",
    "endNamed": "End {app}",
    "hogTitle": "{app} is using {pct} of total CPU",
    "hogSub": "Above {pct} of total CPU for over 2 min",
    "privacy": "Local-only · 0 network",
    "quit": "Quit",
    "confirmTitle": "Quit {app}?",
    "confirmSub": "Unsaved work in this app may be lost.",
    "confirmBtn": "Quit app",
    "cancel": "Cancel",
    "toastEnded": "{app} ended · CPU settling back to normal",
    "toastMonitor": "Opening {monitor}…",
    "toastRestored": "Ended apps restored",
    "openMonitor": "Open {monitor}",
    "tipCore": "Core share",
    "tipUserKernel": "User / Kernel",
    "tipRam": "RAM",
    "tipGpu": "GPU",
    "tipProc": "Processes",
    "tipClick": "Click for 10-min timeline →",
    "back": "Back",
    "ago10": "10m ago",
    "ago5": "5m",
    "now": "Now",
    "agoMS": "{m}m {s}s ago",
    "agoS": "{s}s ago",
    "agoM": "{m}m ago",
    "last10": "Last 10 minutes",
    "peakAvg": "Peak {peak} · Avg {avg}",
    "peakSplit": "Peak {a} · {b}",
    "read": "Read",
    "write": "Write",
    "down": "Down",
    "up": "Up",
    "unitCpu": "CPU",
    "unitRam": "RAM",
    "unitGpu": "GPU",
    "unitOfCpu": "of CPU",
    "tUser": "User",
    "tSystem": "System",
    "tIdle": "Idle",
    "tLoad": "Load average",
    "tZramStored": "ZRAM stored",
    "tZramRatio": "ZRAM ratio",
    "zramSub": "ZRAM compressing {orig} into {comp} · VMs share {pct}",
    "tDraw": "Draw",
    "tTimeLeft": "Time left",
    "tHealth": "Health",
    "tCycles": "Cycles",
    "tCapacity": "Capacity",
    "tSource": "Source",
    "tBattery": "Battery",
    "tCpuDie": "CPU die",
    "tStorage": "Storage",
    "tFans": "Fans",
    "tThrottling": "Throttling",
    "tTemperature": "Temperature",
    "tVideoMem": "Video memory",
    "tCoreClock": "Core clock",
    "tPower": "Power",
    "tHotspot": "Hotspot",
    "tUsed": "Used",
    "tFree": "Free",
    "tVerified": "Verified",
    "tFormat": "Format",
    "tInterface": "Interface",
    "tLatency": "Latency",
    "tToday": "Today",
    "tThreads": "Threads",
    "aSettings": "Settings",
    "simHog": "Simulate CPU hog",
    "simHogSub": "One app holds more than {pct} of total CPU",
    "simCharging": "Charging",
    "simChargingSub": "{adapter} adapter connected",
    "simLive": "Live updates",
    "simLiveSub": "Refresh readings every {secs}",
    "seconds": "{n} s",
    "tempUnit": "Temperature unit",
    "restore": "Restore ended apps",
    "restoreBtn": "Restore",
    "simNote": "These switches turn on demo data.",
    "closedRunning": "Pulse is still running in the {bar}. Click its icon to reopen.",
    "closedQuit": "Pulse has quit.",
    "openPulse": "Open Pulse",
    "relaunch": "Relaunch Pulse",
    "aClose": "Close",
    "aLang": "Switch language",
    "language": "Language",
    "languageSub": "Pick the app's language",
    "langSystem": "Match system",
    "aDismiss": "Dismiss alert",
    "aDark": "Dark mode",
    "aLight": "Light mode",
    "menuFile": "File",
    "menuEdit": "Edit",
    "menuView": "View",
    "menuGo": "Go",
    "macClock": "Sun 4 Oct  9:41",
    "winTime": "9:41 AM",
    "winDate": "10/4/2026",
    "chromeTime": "9:41",
    "startXp": "start",
    "start98": "Start",
    "winTitle": "Pulse — System vitals",
    "listSep": " · ",
    "endFailed": "Couldn't end {app}",
    "acPower": "On AC power",
    "noBattery": "No battery"
  },
  "hardware": {
    "coreP": "P-Cores",
    "coreE": "E-Cores",
    "coreZen4": "Zen 4 cores",
    "coreZen4c": "Zen 4c cores",
    "coreN": "Core {n}",
    "user": "User",
    "kernel": "Kernel",
    "wired": "Wired",
    "compressed": "Compressed",
    "system": "System",
    "buffers": "Buffers",
    "cache": "Cache",
    "diskCache": "Disk cache",
    "swapUsed": "Swap used",
    "committed": "Committed",
    "pressure": "Pressure",
    "psiPressure": "PSI pressure",
    "pageFile": "Page file",
    "commitCharge": "Commit charge",
    "swapFile": "Swap file",
    "sysResources": "System resources",
    "normal": "Normal",
    "pctNormal": "{pct} · Normal",
    "pctFree": "{pct} free",
    "localDisk": "Local Disk ({drive})",
    "internalStorage": "Internal storage",
    "fsRoot": "Filesystem root ({path})",
    "drive": "Drive {drive}",
    "lanConnection": "Local Area Connection",
    "dialUp": "Dial-Up Networking",
    "netSub": "{link} · {detail} · {state}",
    "strongSignal": "Strong signal",
    "connected": "Connected",
    "modem": "{speed} modem",
    "signal": "Signal",
    "linkSpeed": "Link speed",
    "lineSpeed": "Line speed",
    "vramUnified": "Unified · {size}",
    "vramShared": "{size} shared",
    "fansOff": "Off · {rpm}",
    "fanless": "Fanless",
    "activityMonitor": "Activity Monitor",
    "taskManager": "Task Manager",
    "diagnostics": "Diagnostics",
    "systemMonitor": "System Monitor",
    "menuBar": "menu bar",
    "taskbar": "taskbar",
    "shelf": "shelf",
    "topBar": "top bar",
    "notificationArea": "notification area"
  },
  "apps": {}
}
